{
  "schema_version": 1,
  "notification_id": "incident-2026-08-11.2",
  "request_fingerprint": "243bd0802b3cce4da405566e5b062d1517b789ae25cae2069989342bae009027",
  "route_fingerprint": "46931487f9f877d1c69576c693e44e829f26217c8a6871288d7f3512101cb5a3",
  "delivery_policy": "broadcast",
  "state": "terminal",
  "phase": "complete",
  "planned_attempts": [
    {
      "channel": "telegram.team",
      "provider": "telegram",
      "acceptance_scope": "provider_api_only"
    },
    {
      "channel": "email.owner",
      "provider": "smtp",
      "acceptance_scope": "smtp_relay_only"
    }
  ],
  "next_attempt_index": 2,
  "attempts": [
    {
      "channel": "telegram.team",
      "provider": "telegram",
      "status": "uncertain",
      "reason": "transport_ambiguous",
      "acceptance_scope": "provider_api_only",
      "transformations": ["title_prefixed_to_body"]
    },
    {
      "channel": "email.owner",
      "provider": "smtp",
      "status": "accepted",
      "reason": "provider_accepted",
      "acceptance_scope": "smtp_relay_only",
      "transformations": []
    }
  ],
  "receipt": {
    "schema_version": 1,
    "notification_id": "incident-2026-08-11.2",
    "request_fingerprint": "243bd0802b3cce4da405566e5b062d1517b789ae25cae2069989342bae009027",
    "delivery_policy": "broadcast",
    "status": "partial",
    "attempts": [
      {
        "channel": "telegram.team",
        "provider": "telegram",
        "status": "uncertain",
        "reason": "transport_ambiguous",
        "acceptance_scope": "provider_api_only",
        "transformations": ["title_prefixed_to_body"]
      },
      {
        "channel": "email.owner",
        "provider": "smtp",
        "status": "accepted",
        "reason": "provider_accepted",
        "acceptance_scope": "smtp_relay_only",
        "transformations": []
      }
    ]
  },
  "recovery_count": 1,
  "created_at": "2026-08-11T08:20:00Z",
  "updated_at": "2026-08-11T08:20:05Z",
  "completed_at": "2026-08-11T08:20:05Z",
  "expires_at": "2026-09-10T08:20:05Z"
}
